date,title,url,source,topic
2021-08-12T23:05:59Z,'Field of Dreams' Game: Kevin Costner Cusses on Live TV Pregame Show,https://www.newsweek.com/field-dreams-game-kevin-costner-cusses-live-tv-pregame-show-1618988,,Field of Dreams game
2021-08-12T15:34:00Z,"What to know about the movie-inspired Field of Dreams Game: Time, channel",https://nypost.com/2021/08/12/field-of-dreams-game-time-how-to-watch-yankees-white-sox/,,Field of Dreams game
2021-08-12T15:31:50Z,Yankees share excitement for Field of Dreams game: 'This is kinda a dream come true',https://sports.yahoo.com/yankees-share-excitement-field-dreams-152104737.html,,Field of Dreams game
2021-08-12T16:00:56Z,Field of Dreams Game Steps Into Reality for MLB Grounds Crew,https://sports.yahoo.com/field-dreams-game-steps-reality-160056056.html,,Field of Dreams game
2021-08-12T20:26:57Z,"How to watch the MLB 'Field of Dreams' game: What channel, what time and more",https://news.yahoo.com/watch-mlb-field-dreams-game-202657730.html,,Field of Dreams game
2021-08-12T20:08:27Z,Kevin Costner Returns To ’Field Of Dreams’ 32 Years After Hit Movie: Watch Him Play Ball,https://hollywoodlife.com/2021/08/12/kevin-costner-field-of-dreams-game/,,Field of Dreams game
2021-08-12T07:43:24Z,"Fred moves toward Florida, 2020 Census, Boy Scouts bankruptcy case: 5 things to know Thursday",https://www.usatoday.com/story/news/2021/08/12/tropical-depression-fred-census-data-5-things-know-thursday/5553768001/,,Field of Dreams game
2021-08-12T15:59:02Z,How Trey Lance has impressed George Kittle most in 49ers practice,https://sports.yahoo.com/trey-lance-impressed-george-kittle-155902807.html,,Field of Dreams game
2021-08-12T16:09:18Z,"MLB DFS: Top DraftKings, FanDuel daily Fantasy baseball picks, strategy, advice for August 12, 2021",https://www.cbssports.com/mlb/news/mlb-dfs-top-draftkings-fanduel-daily-fantasy-baseball-picks-strategy-advice-for-august-12-2021/,,Field of Dreams game
2021-08-12T13:49:46Z,"Which unique venue should MLB turn to next? Plus, how Baylor avoided NCAA punishment",https://www.cbssports.com/mlb/news/which-unique-venue-should-mlb-turn-to-next-plus-how-baylor-avoided-ncaa-punishment/,,Field of Dreams game
2021-08-12T17:10:22Z,Here’s How To Make Guy Fieri’s Apple Pie Hot Dog At Home,https://brobible.com/culture/article/guy-fieri-apple-pie-hot-dog-recipe/,,Field of Dreams game
2021-08-12T14:50:47Z,Where to Watch the MLB Field of Dreams Game (and the Movie!),https://decider.com/2021/08/12/where-to-watch-field-of-dreams/,,Field of Dreams game
2021-08-12T00:19:33Z,Talks underway to bring Chicago Cubs to future 'Field of Dreams' game,https://www.usatoday.com/story/sports/mlb/2021/08/11/field-of-dreams-game-chicago-cubs-could-play-2022/8102806002/,,Field of Dreams game
2021-08-12T21:09:50Z,"After hosting MLB game, what's next for 'Field of Dreams' stadium in Iowa?",https://www.usatoday.com/story/sports/mlb/2021/08/12/mlb-field-of-dreams-stadium-iowa-future/8115681002/,,Field of Dreams game
2021-08-12T07:11:16Z,"Xbox series X stock - live: Today’s UK restock updates from Very, John Lewis, Game and more",https://www.independent.co.uk/extras/indybest/gadgets-tech/video-games-consoles/xbox-series-x-stock-uk-restock-b1900877.html,,Field of Dreams game
2021-08-12T18:24:06Z,"NFL teams can now sign, elevate International Pathway Players to active roster in 2021",https://www.cbssports.com/nfl/news/nfl-teams-can-now-sign-elevate-international-pathway-players-to-active-roster-in-2021/,,Field of Dreams game
2021-08-12T10:25:02Z,"MLB Field of Dreams Game 2021: Time, TV channel, how to watch/stream Yankees-White Sox in Dyersville, Iowa",https://www.usatoday.com/story/sports/mlb/2021/08/12/mlb-field-dreams-2021-time-how-watch-yankees-white-sox-game/5567528001/,,Field of Dreams game
2021-08-12T01:09:28Z,White Sox place Rodón on IL with shoulder fatigue,https://mlb.nbcsports.com/2021/08/11/white-sox-place-rodon-on-il-with-shoulder-fatigue/,,Field of Dreams game
2021-08-12T22:11:16Z,"Yankees, Gerrit Cole walk through Field of Dreams cornfield in surreal scene",https://nypost.com/2021/08/12/video-yankees-cole-walk-through-field-of-dreams-cornfield/,,Field of Dreams game
2021-08-12T10:28:57Z,As MLB brings 'Field of Dreams' to life: Here's 6 other iconic venues we want to see a game,https://www.usatoday.com/story/sports/2021/08/12/mlb-field-dreams-game-iowa-movie/8095430002/,,Field of Dreams game
2021-08-12T12:20:11Z,MLB actually got something right with tonight's 'Field of Dreams' game,https://ftw.usatoday.com/2021/08/field-of-dreams-game-mlb-got-something-right,,Field of Dreams game
2021-08-12T05:48:17Z,"Field of Dreams: Inspired by 1989 film, MLB makes Iowa...",https://www.dailymail.co.uk/news/article-9885367/Field-Dreams-Inspired-1989-film-MLB-makes-Iowa-debut.html,,Field of Dreams game
2021-08-12T21:27:34Z,"Listen to Episode 77 of ‘Pinstripe Pod’: Field of Dreams Game, Baseball Movies feat. Ken Davidoff",https://nypost.com/2021/08/12/listen-to-episode-77-of-pinstripe-pod-field-of-dreams-game/,,Field of Dreams game
2021-08-12T07:18:45Z,Field of Dreams Game: MLB going for once-in-a-lifetime vibe,https://nypost.com/2021/08/12/field-of-dreams-game-mlb-going-for-once-in-a-lifetime-vibe/,,Field of Dreams game
2021-08-12T12:50:34Z,Kevin Costner showed up to play catch at the 'Field of Dreams' site,https://ftw.usatoday.com/2021/08/field-of-dreams-kevin-costner-catch-mlb,,Field of Dreams game
2021-08-12T12:06:00Z,"'Field of Dreams' site still has that magic, more than 30 years later",https://www.today.com/popculture/mlb-s-field-dreams-2021-game-draws-tourists-iowa-t227945,,Field of Dreams game
2021-08-12T10:35:42Z,How a high school-age player proved he belongs at North Carolina,https://www.espn.com/college-football/story/_/id/31992270/the-education-tony-grimes-how-high-school-senior-found-fit-unc,,Field of Dreams game
2021-08-12T07:48:12Z,"Yankees, Aaron Judge excited to play in Field of Dreams Game",https://nypost.com/2021/08/12/yankees-aaron-judge-excited-to-play-in-field-of-dreams-game/,,Field of Dreams game
2021-08-12T10:00:00Z,"Bucs Arghticles: August 12, 2021",https://www.bucsdugout.com/2021/8/12/22615630/pittsburgh-pirates-mlb-news-bucs-arghticles-august-12-2021,,Field of Dreams game
2021-08-12T21:30:45Z,"White Sox, fans ready for magic at first Field of Dreams game",https://wgntv.com/sports/white-sox-fans-ready-for-magic-at-first-field-of-dreams-game/,,Field of Dreams game
2021-08-12T21:48:07Z,"Frank Thomas discusses the White Sox, Field of Dreams game on WGN News Now Sports Talk",https://wgntv.com/sports/frank-thomas-discusses-the-white-sox-field-of-dreams-game-on-wgn-news-now-sports-talk/,,Field of Dreams game
2021-08-12T00:48:59Z,LEADING OFF: ‘Field of Dreams’ game grows in Iowa cornfield,https://www.thestar.com/sports/baseball/2021/08/11/leading-off-field-of-dreams-game-grows-in-iowa-cornfield.html,,Field of Dreams game
2021-08-12T00:40:29Z,"Gerrit Cole, Jordan Montgomery to rejoin Yankees’ rotation soon",https://nypost.com/2021/08/11/gerrit-cole-jordan-montgomery-to-rejoin-yankees-rotation-soon/,,Field of Dreams game
2021-08-12T03:01:13Z,"South Side teens bring talent, baseball’s hard lessons to Field of Dreams",https://wgntv.com/news/trending/south-side-teens-bring-talent-baseballs-hard-lessons-to-field-of-dreams/,,Field of Dreams game
2021-08-12T18:32:55Z,Field of Dreams game: Live coverage of New York Yankees vs. Chicago White Sox in Iowa,https://www.desmoinesregister.com/story/sports/baseball/2021/08/12/mlb-field-of-dreams-game-live-coverage-new-york-yankees-chicago-white-sox-dyersville-iowa/5536602001/,,Field of Dreams game
2021-08-12T20:09:42Z,Ticket Prices For MLB’s ‘Field Of Dreams’ Game Are Positively Outrageous,https://uproxx.com/sports/field-of-dreams-mlb-game-iowa-yankees-white-sox-stubhub-tickets/,,Field of Dreams game
2021-08-12T16:30:28Z,Iowa's Field of Dreams comes to life tonight with White Sox playing the Yankees,https://www.startribune.com/field-of-dreams-white-sox-yankees-iowa-mlb/600087244/,,Field of Dreams game
2021-08-12T15:16:08Z,"MLB's Field Of Dreams Replica Gets Kevin Costner Approval, 'Feels Perfect'",https://www.tmz.com/2021/08/12/mlb-field-of-dreams-replica-kevin-costner-approval-yankees-red-sox/,,Field of Dreams game
2021-08-12T19:45:24Z,Perseid Meteor shower peaks Thursday night and Friday - Tbnewswatch.com,https://www.tbnewswatch.com/local-news/perseid-meteor-shower-peaks-thursday-night-and-friday-4216617,,Meteor shower tonight
2021-08-12T19:07:36Z,"Air quality advisory for Metro Vancouver, Fraser Valley - News 1130",https://www.citynews1130.com/2021/08/12/metro-vancouver-fraser-valley-air-quality/,,Meteor shower tonight
2021-08-12T16:06:13Z,Perseid Meteor Shower Update: ‘Delayed Peak’ Could Be Tonight,https://www.forbes.com/sites/ericmack/2021/08/12/perseid-meteor-shower-update-delayed-peak-could-be-tonight/,,Meteor shower tonight
2021-08-12T05:50:00Z,Look to the sky tonight to get a glimpse of the Perseid Meteor Shower - Hawaii News Now,https://www.hawaiinewsnow.com/2021/08/12/look-sky-tonight-get-glimpse-perseid-meteor-shower/,,Meteor shower tonight
2021-08-12T17:33:04Z,Perseid meteor shower of 2021 thrills skywatchers - Space.com,https://www.space.com/perseid-meteor-shower-2021-thrills-skywatchers,,Meteor shower tonight
2021-08-12T13:51:20Z,The Perseid Media Shower Is Underway,https://www.legitreviews.com/the-perseid-media-shower-is-underway_228688,,Meteor shower tonight
2021-08-12T10:55:45Z,When and Where to Watch the Perseid Meteor Shower Tonight,https://www.newsweek.com/when-where-watch-perseid-meteor-shower-tonight-space-night-sky-1618665,,Meteor shower tonight
2021-08-12T16:49:33Z,Perseid meteor shower in pictures: Best images as shooting star show set to peak tonight,https://www.independent.co.uk/space/perseid-meteor-shower-pictures-images-best-b1901607.html,,Meteor shower tonight
2021-08-12T16:36:18Z,Perseid meteor shower to be visible tonight but clouds could obscure spectacular display,https://www.independent.co.uk/space/perseid-meteor-shower-tonight-weather-cloud-b1901584.html,,Meteor shower tonight
2021-08-12T07:39:30Z,Perseid meteor shower peaks this evening,https://www.dailymail.co.uk/sciencetech/article-9884323/Perseid-meteor-shower-peaks-evening.html,,Meteor shower tonight
2021-08-12T16:37:10Z,Everything you need to know about this evening's meteor shower in London,https://www.timeout.com/london/news/everything-you-need-to-know-about-this-evenings-meteor-shower-in-london-081221,,Meteor shower tonight
2021-08-12T04:52:15Z,"Perseids meteor shower to put on show tonight, this week - KUTV 2News",https://slashdot.org/firehose.pl?op=view&amp;id=150212471,,Meteor shower tonight
2021-08-12T05:52:48Z,Here's the US weather forecast for the Perseid meteor shower's peak tonight - Space.com,https://slashdot.org/firehose.pl?op=view&amp;id=150214935,,Meteor shower tonight
2021-08-12T18:28:05Z,Perseid meteor shower peaks over Vancouver skies tonight and Friday,https://vancouversun.com/news/perseid-meteor-shower-peaks-over-vancouver-skies-tonight-and-friday,,Meteor shower tonight
2021-08-12T21:21:41Z,"Lingering Shower Possible, Mostly Dry Evening Ahead",https://www.wvnstv.com/weather/lingering-shower-possible-mostly-dry-evening-ahead/,,Meteor shower tonight
2021-08-12T14:59:08Z,Bright and mild today; a pleasant weekend is ahead,https://myfox47.com/2021/08/12/bright-and-mild-today-a-pleasant-weekend-is-ahead/,,Meteor shower tonight
2021-08-15T20:10:10Z,Opinion: Afghanistan's first female ambassador to the US: 'It was avoidable',https://www.cnn.com/2021/08/15/opinions/afghanistan-taliban-takeover-us-withdrawal-bergen/index.html,CNN,Afghanistan
2021-08-15T12:45:51Z,Taliban spokesman tells BBC they are 'awaiting a peaceful transfer of power',https://www.bbc.co.uk/news/av/world-asia-58220305,BBC News,Afghanistan
2021-08-15T18:50:38Z,Top US general says terror groups could reconstitute in Afghanistan sooner than expected,https://www.cnn.com/2021/08/15/politics/mark-milley-afghanistan-terror-groups/index.html,CNN,Afghanistan
2021-08-15T12:09:25Z,US completely pulling out of embassy in Afghanistan over the next 72 hours,https://www.cnn.com/2021/08/15/politics/us-embassy-kabul-afghanistan/index.html,CNN,Afghanistan
2021-08-15T16:31:09Z,The abandonment of Afghanistan is shameful | Letters,https://amp.theguardian.com/world/2021/aug/15/the-abandonment-of-afghanistan-is-shameful,The Guardian,Afghanistan
2021-08-15T14:08:00Z,"'A very dark time': Canada shuts down embassy in Afghanistan, citing safety concerns - CTV News",https://www.ctvnews.ca/canada/a-very-dark-time-canada-shuts-down-embassy-in-afghanistan-citing-safety-concerns-1.5547860,Ctvnews.ca,Afghanistan
2021-08-15T16:36:00Z,Factbox-Taliban seek to present a moderate face as they take control in Afghanistan - Reuters,https://www.reuters.com/article/us-afghanistan-conflict-taliban-promises-idUSKBN2FG0GU,Reuters,Afghanistan
2021-08-15T13:56:00Z,Afghan Pres Ghani leaves for Tajikistan - interior ministry official - Reuters,https://www.reuters.com/world/asia-pacific/afghan-pres-ghani-leaves-tajikistan-interior-ministry-official-2021-08-15/,Reuters,Afghanistan
2021-08-15T14:23:36Z,Afghan president Ashraf Ghani has left the country as Taliban move on Kabul - The Globe and Mail,https://www.theglobeandmail.com/world/article-afghan-president-ashraf-ghani-has-left-the-country-as-taliban-move-on/,The Globe And Mail,Afghanistan
2021-08-15T23:13:00Z,Timeline: The Taliban's rapid advance across Afghanistan - Reuters,https://www.reuters.com/world/timeline-talibans-rapid-advance-across-afghanistan-2021-08-15/,Reuters,Afghanistan
2021-08-15T10:03:00Z,Reactions as the Taliban entered Kabul - Reuters,https://www.reuters.com/world/asia-pacific/reactions-taliban-entered-kabul-2021-08-15/,Reuters,Afghanistan
2021-08-15T10:32:00Z,"Pope urges dialogue in Afghanistan so people can live in peace, security - Reuters",https://www.reuters.com/world/pope-urges-dialogue-afghanistan-so-people-can-live-peace-security-2021-08-15/,Reuters,Afghanistan
2021-08-15T16:24:00Z,Nepal calls for evacuation of at least 1500 Nepalis in Afghanistan - Reuters,https://www.reuters.com/world/asia-pacific/nepal-calls-evacuation-least-1500-nepalis-afghanistan-2021-08-15/,Reuters,Afghanistan
2021-08-15T15:18:00Z,Taliban officials: there will be no transitional government in Afghanistan - Reuters,https://www.reuters.com/world/asia-pacific/taliban-officials-there-will-be-no-transitional-government-afghanistan-2021-08-15/,Reuters,Afghanistan
2021-08-15T09:57:00Z,QUOTES-Reactions as the Taliban entered Kabul - Reuters,https://www.reuters.com/article/us-afghanistan-conflict-reaction-idUSKBN2FG08O,Reuters,Afghanistan
2021-08-15T16:53:29Z,Taliban move into Kabul as Afghan government collapses,https://www.bbc.co.uk/news/world-asia-58223231,BBC News,Afghanistan
2021-08-15T14:23:00Z,NATO maintains diplomatic presence in Kabul despite Taliban advances - Reuters,https://www.reuters.com/world/asia-pacific/nato-maintains-diplomatic-presence-kabul-despite-taliban-advances-2021-08-15/,Reuters,Afghanistan
2021-08-15T15:27:00Z,Ashraf Ghani: departing Afghan president who failed to make peace with Taliban - Reuters,https://www.reuters.com/world/asia-pacific/ashraf-ghani-departing-afghan-president-who-failed-make-peace-with-taliban-2021-08-15/,Reuters,Afghanistan
2021-08-15T20:11:13Z,'PLEASE HELP US:' Canadian embassy security worker pleads for help as Taliban move in - Toronto Sun,https://torontosun.com/news/please-help-us-canadian-embassy-security-worker-pleads-for-help-as-taliban-move-in,Toronto Sun,Afghanistan
2021-08-15T10:14:00Z,UK parliament to be recalled next week to discuss Afghanistan - source - Reuters UK,https://www.reuters.com/world/uk/uk-parliament-be-recalled-next-week-discuss-afghanistan-sky-news-2021-08-15/,Reuters,Afghanistan
2021-08-15T22:13:00Z,"Taliban spokesman says ""the war is over in Afghanistan"" - Al Jazeera - Reuters",https://www.reuters.com/world/asia-pacific/taliban-spokesman-says-war-is-over-afghanistan-al-jazeera-2021-08-15/,Reuters,Afghanistan
2021-08-15T15:13:00Z,"Deep concern over Afghanistan's future, violence must end - UK's Raab - Reuters",https://www.reuters.com/world/uk/deep-concern-over-afghanistans-future-violence-must-end-uks-raab-2021-08-15/,Reuters,Afghanistan
2021-08-15T16:57:00Z,"Countries should not recognise Taliban as Afghan government, says UK's Johnson - Reuters",https://www.reuters.com/world/uk/countries-should-not-recognise-taliban-afghan-government-says-uks-johnson-2021-08-15/,Reuters,Afghanistan
2021-08-15T01:17:00Z,British ambassador to be flown out of Afghanistan on Sunday -newspaper - Reuters,https://www.reuters.com/world/asia-pacific/british-ambassador-be-flown-out-afghanistan-sunday-newspaper-2021-08-14/,Reuters,Afghanistan
2021-08-15T17:34:00Z,UAE says working to facilitate evacuation of foreign diplomats from Afghanistan - Reuters,https://www.reuters.com/world/middle-east/uae-says-working-facilitate-evacuation-foreign-diplomats-afghanistan-2021-08-15/,Reuters,Afghanistan
2021-08-15T21:02:00Z,"U.N. chief urges Taliban restraint, is concerned about women, girls - Reuters",https://www.reuters.com/world/un-chief-urges-taliban-restraint-is-concerned-about-women-girls-2021-08-15/,Reuters,Afghanistan
2021-08-15T20:23:52Z,The fall of Kabul: a 20-year mission collapses in a single day,https://amp.theguardian.com/world/2021/aug/15/the-fall-of-kabul-a-20-year-mission-collapses-in-a-single-day,The Guardian,Afghanistan
2021-08-15T18:45:00Z,Afghan president Ghani says he left country in order to avoid bloodshed - Reuters,https://www.reuters.com/world/asia-pacific/afghan-president-ghani-says-he-left-country-order-avoid-bloodshed-2021-08-15/,Reuters,Afghanistan
2021-08-15T17:52:00Z,German military aircraft to head to Afghanistan tonight for evacuation - Reuters,https://www.reuters.com/article/afghanistan-conflict-germany-maas-idUSS8N2M802V,Reuters,Afghanistan
2021-08-15T11:43:17Z,Afghan conflict: Taliban enter outskirts of the capital Kabul,https://www.bbc.co.uk/news/world-asia-58222066,BBC News,Afghanistan
2021-08-15T20:48:23Z,"Biden followed through on his promise to swiftly end America's longest war, and may be held responsible for the tragedy unfolding",https://www.businessinsider.com/biden-blame-for-afghanistan-troop-pullout-kabul-taliban-2021-8,Business Insider,Afghanistan
2021-08-15T05:15:04Z,Afghanistan will be seen as Joe Biden’s defeat. And it may come back to haunt him,https://amp.theguardian.com/commentisfree/2021/aug/15/afghanistan-will-be-seen-as-joe-bidens-defeat-and-it-may-come-back-to-haunt-him,The Guardian,Afghanistan
2021-08-15T05:24:53Z,Kabul: US starts evacuating embassy as Taliban reach outskirts of Afghanistan capital,https://amp.theguardian.com/world/2021/aug/15/taliban-afghanistan-kabul-evacuations-jalalabad,The Guardian,Afghanistan
2021-08-15T14:58:00Z,Foreign Office blocks Afghan students from UK scholarships,https://amp.theguardian.com/politics/2021/aug/15/foreign-office-blocks-afghan-students-from-uk-scholarships,The Guardian,Afghanistan
2021-08-15T09:58:00Z,Austria plans aid conference for Afghanistan's neighbours - Reuters,https://www.reuters.com/world/asia-pacific/austria-plans-aid-conference-afghanistans-neighbours-2021-08-15/,Reuters,Afghanistan
2021-08-15T04:21:09Z,"Taliban Seize Jalalabad, Cut Off Afghan Capital From East",https://www.huffpost.com/entry/taliban-seize-jalalabad-afghanistan_n_611892d1e4b01da700f67b75,HuffPost,Afghanistan
2021-08-15T14:30:11Z,Canada temporarily closes embassy in Kabul as former Afghan employees beg for help - The Globe and Mail,https://www.theglobeandmail.com/world/article-canada-temporarily-closes-embassy-in-kabul-as-former-afghan-employees/,The Globe And Mail,Afghanistan
2021-08-15T18:50:10Z,Boris Johnson intervenes over visas for Afghan students,https://amp.theguardian.com/world/2021/aug/15/boris-johnson-promises-visas-to-afghan-students-amid-taliban-advance,The Guardian,Afghanistan
2021-08-15T08:55:00Z,Factbox-The Taliban: key facts on the Islamic militant group - Reuters,https://www.reuters.com/article/us-afghanistan-conflict-taliban-factbox-idUSKBN2FG07D,Reuters,Afghanistan
2021-08-15T04:29:04Z,"The Taliban Seize Jalalabad, Cutting Off Kabul To The East",https://www.npr.org/2021/08/15/1027806863/the-taliban-seize-jalalabad-cutting-off-kabul-to-the-east,NPR,Afghanistan
2021-08-15T20:01:07Z,"This striking photo was taken as the US rushed to evacuate its embassy in Kabul, which some critics are calling Biden's 'Saigon moment'",https://www.businessinsider.com/photo-captures-embassy-evacuation-some-call-bidens-saigon-moment-2021-8,Business Insider,Afghanistan
2021-08-15T14:10:22Z,A tale of two armies: why Afghan forces proved no match for the Taliban,https://amp.theguardian.com/world/2021/aug/15/a-tale-of-two-armies-why-afghan-forces-proved-no-match-for-the-taliban,The Guardian,Afghanistan
2021-08-15T00:44:57Z,"Biden Orders 1,000 More U.S. Troops For ‘Orderly’ Afghanistan Departure",https://www.huffpost.com/entry/joe-biden-afghanistan-troops-departure_n_61185e48e4b07c140315a2a3,HuffPost,Afghanistan
2021-08-15T21:40:38Z,Secretary Blinken Defends Afghanistan Troop Withdrawal Amid Criticism,https://www.huffpost.com/entry/secretary-blinken-on-afghanistan-troop-withdrawal_n_61196712e4b01da700f6e031,HuffPost,Afghanistan
2021-08-15T21:18:00Z,UK PM Boris Johnson intervenes over visas for Afghan students -The Guardian - Reuters,https://www.reuters.com/world/asia-pacific/uk-pm-boris-johnson-intervenes-over-visas-afghan-students-the-guardian-2021-08-15/,Reuters,Afghanistan
2021-08-15T19:22:14Z,An Afghan woman in Kabul: ‘Now I have to burn everything I achieved’,https://amp.theguardian.com/world/2021/aug/15/an-afghan-woman-in-kabul-now-i-have-to-burn-everything-i-achieved,The Guardian,Afghanistan
2021-08-15T19:04:38Z,President Biden's biggest defeat: Afghanistan war ends amid chaos and broken promises,https://www.usatoday.com/restricted/?return=https%3A%2F%2Fwww.usatoday.com%2Fstory%2Fnews%2Fpolitics%2F2021%2F08%2F15%2Fbidens-biggest-defeat-afghanistan-withdrawal-kabuls-collapse%2F8142920002%2F,USA Today,Afghanistan
2021-08-15T13:12:34Z,"Afghanistan updates: US airport operations continue, Taliban negotiate in Kabul",https://abcnews.go.com/Politics/afghanistan-updates-us-airport-operations-continue-taliban-negotiate/story?id=79464831,ABC News,Afghanistan
2021-08-15T13:21:22Z,Biden and Trump bear responsibility for Afghanistan: Cheney,https://abcnews.go.com/Politics/biden-trump-bear-responsibility-afghanistan-cheney/story?id=79458255,ABC News,Afghanistan
2021-08-15T05:00:00Z,Taliban surge exposes failure of U.S. efforts to build Afghan army - Reuters Africa,https://www.reuters.com/world/asia-pacific/taliban-surge-exposes-failure-us-efforts-build-afghan-army-2021-08-15/,Reuters,Afghanistan
2021-08-15T20:21:06Z,WATCH: Shark swims close to shore in Spain,https://abcnews.go.com/International/video/shark-swims-close-shore-spain-79469504,ABC News,Afghanistan
2021-08-15T20:24:34Z,WATCH: 11-year-old boy walks across England to save Earth,https://abcnews.go.com/International/video/11-year-boy-walks-england-save-earth-79469679,ABC News,Afghanistan
2021-08-15T16:14:00Z,'Gunfire at the airport': US officials evacuate embassy as Taliban enters Kabul,https://news.yahoo.com/gunfire-airport-us-officials-evacuate-161400238.html,Yahoo Entertainment,Afghanistan
2021-08-15T11:34:00Z,Germany sending A400M planes for Kabul evacuation - Bild am Sonntag - Reuters,https://www.reuters.com/world/germany-sending-a400m-planes-kabul-evacuation-bild-am-sonntag-2021-08-15/,Reuters,Afghanistan
2021-08-15T17:47:24Z,Official says Taliban to declare Islamic Emirate,https://apnews.com/article/afghanistan-kabul-taliban-1794266cda1492f4128363572bc2cff6,Associated Press,Afghanistan
2021-08-15T16:17:28Z,Afghan President Ashraf Ghani Leaves the Country as Taliban Move on Kabul,https://time.com/6090508/afghanistan-taliban-president/,Time,Afghanistan
2021-08-15T20:22:38Z,WATCH: Huge clouds of smoke rise from Utah wildfire,https://abcnews.go.com/US/video/huge-clouds-smoke-rise-utah-wildfire-79469558,ABC News,Afghanistan
2021-08-15T10:00:05Z,US criticised as it races against time to save its Afghan helpers from Taliban,https://amp.theguardian.com/world/2021/aug/15/us-criticised-as-it-races-against-time-to-save-its-afghan-helpers-from-taliban,The Guardian,Afghanistan
2021-08-15T11:15:15Z,Afghanistan Meant Nothing: A Veteran Reflects on 20 Wasted Years,https://laurajedeed.medium.com/afghanistan-meant-nothing-9e3f099b00e5,Medium,Afghanistan
2021-08-15T16:15:51Z,How did the Taliban retake Afghanistan so fast? What's happening now? What we know,https://www.usatoday.com/restricted/?return=https%3A%2F%2Fwww.usatoday.com%2Fstory%2Fnews%2Fpolitics%2F2021%2F08%2F15%2Fkabul-and-taliban-what-know-us-withdrawal-afghanistan%2F8142051002%2F,USA Today,Afghanistan
2021-08-15T12:13:00Z,"Taliban storms Kabul, demands unconditional surrender of government; US scrambles to pull out embassy workers",https://news.yahoo.com/taliban-storms-kabul-demands-unconditional-121300015.html,Yahoo Entertainment,Afghanistan
2021-08-15T14:17:00Z,Afghan President Ashraf Ghani flees country,https://news.yahoo.com/afghan-president-ashraf-ghani-flees-141700073.html,Yahoo Entertainment,Afghanistan
2021-08-15T13:48:00Z,Taliban fighters reported at the gates of Afghan capital,https://news.yahoo.com/taliban-fighters-reported-gates-afghan-134800598.html,Yahoo Entertainment,Afghanistan
2021-08-15T20:35:15Z,Afghan President Was Politically Isolated Before Slipping Into Exile,https://www.huffpost.com/entry/afghan-president-politically-isolated-before-fleeing_n_6119764ae4b0454ed70ee0e0,HuffPost,Afghanistan
2021-08-15T16:53:01Z,‘This is manifestly not Saigon’: Blinken defends US mission in Afghanistan,https://amp.theguardian.com/us-news/2021/aug/15/antony-blinken-us-mission-afghanistan-saigon,The Guardian,Afghanistan
