date,title,url,source,topic
2021-08-15T16:00:00Z,Fuel blast in Lebanon kills 28,https://www.taipeitimes.com/News/world/archives/2021/08/16/2003762698,Taipei Times,Lebanon
2021-08-15T17:08:06Z,Mob attacks home of exploded warehouse owner in Lebanon,https://www.euronews.com/2021/08/15/mob-attacks-home-of-exploded-warehouse-owner-in-lebanon,Euronews,Lebanon
2021-08-15T05:11:51Z,Red Cross: At least 20 dead in explosion in Lebanon,http://www.dpa-international.com/topic/red-cross-least-20-dead-explosion-lebanon-urn%3Anewsml%3Adpa.com%3A20090101%3A210815-99-846282,Dpa-international.com,Lebanon
2021-08-15T08:16:31Z,Meretz MK speaks of ‘complex’ coalition after warning she wouldn’t back war,https://www.timesofisrael.com/meretz-mk-speaks-of-complex-coalition-after-warning-she-wouldnt-back-war/,The Times of Israel,Lebanon
2021-08-15T19:22:40Z,What America's Middle Eastern allies can learn from the collapse of Afghanistan,https://www.haaretz.com/us-news/.premium-what-america-s-middle-eastern-allies-can-learn-from-afghanistan-1.10120495,Haaretz,Lebanon
2021-08-15T14:32:57Z,Haiti earthquake: Rescuers search rubble for survivors,https://www.bbc.co.uk/news/world-latin-america-58222888,BBC News,Haiti Earthquake
2021-08-15T00:37:00Z,Osaka to donate prize money to Haitian earthquake relief efforts - Reuters,https://www.reuters.com/lifestyle/sports/osaka-donate-prize-money-haitian-earthquake-relief-efforts-2021-08-15/,Reuters,Haiti Earthquake
2021-08-15T05:16:45Z,Haitians scramble to rescue survivors from ruins of major quake - Reuters,https://www.reuters.com/world/americas/haitians-scramble-rescue-survivors-ruins-major-quake-2021-08-15/,Reuters,Haiti Earthquake
2021-08-15T03:38:00Z,Another quake of magnitude 5.9 strikes Haiti Region - EMSC - Reuters,https://www.reuters.com/article/haiti-quake-aftershock-idUSFWN2PK1EX,Reuters,Haiti Earthquake
2021-08-15T15:16:57Z,Powerful Earthquake in Haiti Kills At Least 304,https://time.com/6090498/haiti-powerful-earthquake/,Time,Haiti Earthquake
2021-08-15T04:32:00Z,"For Haitians, quake reawakens trauma of disaster a decade ago - Reuters",https://www.reuters.com/world/americas/haitians-quake-reawakens-trauma-disaster-decade-ago-2021-08-15/,Reuters,Haiti Earthquake
2021-08-15T00:26:43Z,Photos: A Horrific Earthquake in Haiti,https://www.theatlantic.com/photo/2021/08/photos-horrific-earthquake-haiti/619763/?utm_source=feed,The Atlantic,Haiti Earthquake
2021-08-15T14:10:05Z,"Apple committed to donating money to Haiti after earthquake, Tim Cook tweets",https://9to5mac.com/2021/08/15/apple-committed-to-donating-money-to-haiti-after-earthquake-tim-cook-tweets/,9to5Mac,Haiti Earthquake
2021-08-15T14:48:48Z,Cook pledges Apple's support following Haiti earthquake,https://appleinsider.com/articles/21/08/15/cook-pledges-apples-support-following-haiti-earthquake,AppleInsider,Haiti Earthquake
2021-08-15T17:43:07Z,"Fred aims for Florida Panhandle, Tropical Storm Grace targets Puerto Rico and Haiti",https://abcnews.go.com/US/fred-aims-florida-panhandle-tropical-storm-grace-targets/story?id=79468003,ABC News,Haiti Earthquake
2021-08-15T16:10:20Z,Death toll from Haiti earthquake rises to more than 700,https://www.politico.com/news/2021/08/15/haiti-earthquake-death-toll-504818,Politico,Haiti Earthquake
2021-08-15T13:01:54Z,Naomi Osaka Donating Prize Money to Haiti's Relief Effort after Earthquake,https://www.tmz.com/2021/08/15/naomi-osaka-donating-prize-money-to-haiti-relief-earthquake-tennis/,TMZ,Haiti Earthquake
2021-08-15T17:48:58Z,Tropical Storm Fred Strengthens Again in Gulf Near Florida,https://www.bloomberg.com/news/articles/2021-08-15/tropical-storm-fred-strengthens-again-in-gulf-near-florida,Bloomberg,Haiti Earthquake
2021-08-15T16:39:00Z,"Fred reforms into tropical storm and targets Florida, Grace continues to churn in Caribbean",https://news.yahoo.com/fred-reforms-tropical-storm-targets-163900196.html,Yahoo Entertainment,Haiti Earthquake
2021-08-15T02:05:21Z,Powerful Earthquake Hits Haiti,https://www.forbes.com/sites/unicefusa/2021/08/14/powerful-earthquake-hits-haiti/,Forbes,Haiti Earthquake
2021-08-15T09:06:38Z,"At least 304 dead, 1,800 hurt as powerful quake slams Haiti",https://phys.org/news/2021-08-dead-powerful-quake-slams-haiti.html,Phys.Org,Haiti Earthquake
2021-08-15T06:54:58Z,Powerful quake kills hundreds in Haiti,https://www.aljazeera.com/gallery/2021/8/15/powerful-quake-kills-hundreds-in-haiti,Al Jazeera English,Haiti Earthquake
2021-08-15T14:08:48Z,Tropical Storm Grace Heads Toward Earthquake-Ravaged Haiti,https://www.nytimes.com/2021/08/15/world/americas/haiti-tropical-storm-grace-path.html,New York Times,Haiti Earthquake
2021-08-15T22:50:42Z,"‘I’m the Only Surgeon’: After Haiti Quake, Thousands Seek Scarce Care",https://www.nytimes.com/2021/08/15/world/americas/haiti-earthquake.html,New York Times,Haiti Earthquake
2021-08-15T04:00:00Z,Sunday morning UK news briefing: Today's top headlines from The Telegraph,https://www.telegraph.co.uk/news/2021/08/15/sunday-morning-uk-news-briefing-todays-top-headlines-telegraph/,Telegraph.co.uk,Haiti Earthquake
2021-08-15T14:46:53Z,Haiti Live Updates: Search for Survivors After Deadly Quake Kills Hundreds,https://www.nytimes.com/live/2021/08/15/world/haiti-earthquake,New York Times,Haiti Earthquake
2021-08-15T17:25:30Z,Haiti: drone footage shows devastation after deadly earthquake,https://www.theguardian.com/world/video/2021/aug/15/haiti-drone-footage-shows-devastation-after-deadly-72-magnitude-earthquake,The Guardian,Haiti Earthquake
2021-08-15T17:18:01Z,"Death toll from Haiti earthquake rises to more than 700, rescuers look for survivors",https://www.cbc.ca/news/world/haiti-earthquake-death-toll-climbs-1.6141724,CBC News,Haiti Earthquake
2021-08-15T18:50:14Z,Haitians heartbroken as deadly quake heaps misery on crisis-hit nation,https://amp.theguardian.com/world/2021/aug/15/haitians-heartbroken-as-deadly-quake-heaps-misery-on-crisis-hit-nation,The Guardian,Haiti Earthquake
2021-08-15T16:15:40Z,At least 724 dead in Haiti earthquake as death toll climbs,https://amp.theguardian.com/world/2021/aug/15/dead-injured-haiti-earthquake-death-toll-climbs,The Guardian,Haiti Earthquake
2021-08-15T18:39:12Z,Haiti earthquake sparks memories of 2010 incident for Sask. resident,https://www.cbc.ca/news/canada/saskatoon/haiti-earthquake-2010-memories-1.6141797,CBC News,Haiti Earthquake
2021-08-15T19:34:11Z,Death toll rises to over 700 in Haiti quake,https://www.euronews.com/2021/08/15/death-toll-rises-to-over-700-in-haiti-quake,Euronews,Haiti Earthquake
2021-08-15T02:45:00Z,Some in U.S. waiting to hear from family members in Haiti after earthquake - KCRA Sacramento,https://www.kcra.com/article/some-us-waiting-to-hear-family-members-haiti-after-earthquake/37309456,KCRA Sacramento,Haiti Earthquake
2021-08-15T13:53:48Z,Haitians work through night to recover survivors from rubble after major earthquake,https://www.telegraph.co.uk/world-news/2021/08/15/haitians-work-night-recover-survivors-rubble-major-earthquake/,Telegraph.co.uk,Haiti Earthquake
2021-08-15T08:50:33Z,Tropical Storm Grace to impact Puerto Rico Sunday as it moves through Caribbean - WKMG News 6 & ClickOrlando,https://www.clickorlando.com/weather/2021/08/15/tropical-storm-grace-to-impact-puerto-rico-sunday-as-it-moves-through-caribbean/,WKMG News 6 & ClickOrlando,Haiti Earthquake
2021-08-15T13:24:00Z,"Tropical Storm Grace on track to reach Gulf of Mexico; Fred heads toward Florida, Alabama - NOLA.com",https://www.nola.com/news/hurricane/article_308fd7a6-fdcc-11eb-95bd-c71957e03cdf.html,NOLA.com,Haiti Earthquake
2021-08-15T14:38:53Z,'Houses are crumbling again.' 'I hope they hear us praying.' Haiti support post-earthquake,https://www.usatoday.com/story/news/world/2021/08/15/earthquake-haiti-2021-support-hundreds-dead/8136100002/,USA Today,Haiti Earthquake
2021-08-15T05:39:39Z,"Tropical storm grace forms over Caribbean, speeding toward islands",https://indianexpress.com/article/world/tropical-storm-grace-forms-over-caribbean-speeding-toward-islands-7454639/,The Indian Express,Haiti Earthquake
2021-08-15T13:13:22Z,Sunday Summary: Headlines for August 15,https://www.cbsnews.com/video/sunday-summary-headlines-for-august-15-2021/,CBS News,Haiti Earthquake
2021-08-15T21:00:26Z,Here's the biggest news you missed this weekend,https://www.usatoday.com/story/news/2021/08/15/taliban-overrun-kabul-afghanistan-haiti-earthquake-weekends-news/8141707002/,USA Today,Haiti Earthquake
2021-08-15T21:12:59Z,Haitian chef speaks out on devastation following 7.2 magnitude earthquake,https://www.cbsnews.com/video/haitian-chef-speaks-out-on-devastation-following-72-magnitude-earthquake/,CBS News,Haiti Earthquake
2021-08-15T17:08:25Z,Haiti earthquake death toll soars to over 700,https://nypost.com/2021/08/15/haiti-earthquake-death-toll-soars-to-over-700/,New York Post,Haiti Earthquake
2021-08-15T14:09:51Z,'Our ancestors' blood is strong': Tennis star Naomi Osaka pledges to donate prize money to victims of devastating Haiti earthquake,https://www.rt.com/sport/532101-naomi-osaka-haiti-earthquake/,RT,Haiti Earthquake
2021-08-15T17:03:24Z,Death toll in Haiti earthquake climbs to 724,https://www.cbsnews.com/news/haiti-earthquake-death-toll-rises-2021-08-15/,CBS News,Haiti Earthquake
2021-08-15T17:26:59Z,"More than 700 confirmed dead, thousands injured by Haiti quake",https://www.abc.net.au/news/2021-08-16/death-toll-from-haiti-earthquake-soars/100379194,ABC News (AU),Haiti Earthquake
2021-08-15T16:12:12Z,Death toll from Haiti earthquake rises to more than 700 - Associated Press,https://apnews.com/article/haiti-earthquake-98f06a322e12f732f94485238d13558c,Associated Press,Haiti Earthquake
2021-08-15T02:16:33Z,Quake-hit Haiti faces fresh threat from Tropical Storm Grace,https://news.yahoo.com/quake-hit-haiti-faces-fresh-021633567.html,Yahoo Entertainment,Haiti Earthquake
2021-08-15T22:49:15Z,Rescuers Race to Find Haiti Quake Survivors as Tropical Storm Approaches,https://slate.com/news-and-politics/2021/08/rescuers-race-haiti-quake-survivors-tropical-storm-grace.html,Slate Magazine,Haiti Earthquake
2021-08-15T10:13:00Z,"Haiti Earthquake: At Least 724 Killed, 2,800 Injured After Horrific Tremors; Search for Survivors On - News18",https://www.news18.com/news/world/haiti-earthquake-at-least-724-killed-2800-injured-after-horrific-tremors-search-for-survivors-on-4088654.html,News18,Haiti Earthquake
2021-08-15T00:21:49Z,"Haitians post scenes of devastation, despair and hope on social media after 7.2 quake",https://news.yahoo.com/haitians-post-scenes-devastation-despair-002149456.html,Yahoo Entertainment,Haiti Earthquake
2021-08-15T02:12:17Z,Naomi Osaka to donate prize money to Haitian earthquake relief efforts,https://www.abc.net.au/news/2021-08-15/naomi-osaka-to-donate-prize-money-to-haitian-earthquake-relief/100378366,ABC News (AU),Haiti Earthquake
2021-08-15T08:34:53Z,Haiti earthquake - live: Search for survivors after huge 7.2-magnitude shock kills more than 300 people,https://www.independent.co.uk/news/world/americas/haiti-earthquake-live-news-latest-update-b1902853.html,Independent,Haiti Earthquake
2021-08-15T16:47:49Z,More Than 700 Dead As 7.2 Earthquake Hits Haiti,https://dailycaller.com/2021/08/15/more-than-700-dead-haiti-earthquake/,The Daily Caller,Haiti Earthquake
2021-08-15T21:41:09Z,Rescuers racing in Haiti as storm threatens to follow quake,https://www.bostonglobe.com/2021/08/15/world/rescuers-racing-haiti-storm-threatens-follow-quake/,The Boston Globe,Haiti Earthquake
2021-08-15T08:33:31Z,Haiti earthquake: Over 300 dead as search for survivors begins in country still recovering decade on,https://www.independent.co.uk/news/world/americas/haiti-earthquake-history-2010-comparison-b1902838.html,Independent,Haiti Earthquake
2021-08-15T17:28:01Z,Florida issues tropical storm warning for Panhandle region as Fred approaches,https://amp.theguardian.com/us-news/2021/aug/15/tropical-storm-fred-florida-tropical-storm-grace-caribbean,The Guardian,Haiti Earthquake
2021-08-15T18:44:24Z,Haiti scrambles to coordinate aid response after devastating earthquake,https://www.bostonglobe.com/2021/08/15/world/haiti-scrambles-coordinate-aid-response-after-devastating-earthquake/,The Boston Globe,Haiti Earthquake
2021-08-15T03:09:36Z,"Mass. leaders show support, demand aid for Haiti in wake of 7.2 magnitude earthquake",https://www.bostonglobe.com/2021/08/14/metro/mass-leaders-show-support-demand-aid-haiti-wake-72-magnitude-earthquake/,The Boston Globe,Haiti Earthquake
2021-08-15T22:56:09Z,"Haiti quake death toll shoots to 1,297 as hospitals overwhelmed with some 5,700 injured",https://www.rt.com/news/532128-haiti-death-toll-jumps/,RT,Haiti Earthquake
2021-08-15T17:28:22Z,Naomi Osaka pledges half her tournament winnings to help Haiti,https://ohnotheydidnt.livejournal.com/121430206.html,Livejournal.com,Haiti Earthquake
2021-08-15T23:07:54Z,"Death toll of powerful eathquake in Haiti soars to nearly 1,300",https://www.bostonglobe.com/2021/08/15/world/death-toll-powerful-eathquake-haiti-soars-nearly-1300/,The Boston Globe,Haiti Earthquake
2021-08-15T16:01:01Z,More Than 700 Dead In Haiti Earthquake,https://politicalwire.com/2021/08/15/more-than-700-dead-in-haiti-earthquake/,Politicalwire.com,Haiti Earthquake
2021-08-15T15:19:00Z,"Haiti: Death toll in massive earthquake rises above 1,200",https://www.dw.com/en/haiti-death-toll-in-massive-earthquake-rises-above-1200/a-58871540,DW (English),Haiti Earthquake
2021-08-15T21:54:43Z,"Tropical Storm Grace threatens Haiti, churns across Caribbean",https://www.bostonglobe.com/2021/08/15/nation/tropical-storm-grace-threatens-haiti-churns-across-caribbean/,The Boston Globe,Haiti Earthquake
2021-08-15T23:12:49Z,"Death toll of powerful earthquake in Haiti soars to 1,297",https://www.bostonherald.com/2021/08/15/death-toll-of-powerful-earthquake-in-haiti-soars-to-1297/,Boston Herald,Haiti Earthquake
2021-08-15T16:19:00Z,Haiti's earthquake death toll rises to more than 700,https://www.cnbc.com/2021/08/15/haitis-earthquake-death-toll-rises-to-more-than-700.html,CNBC,Haiti Earthquake
2021-08-15T07:49:12Z,Osaka plans to help out Haiti earthquake relief efforts,https://japantoday.com/category/sports/osaka-plans-to-help-out-haiti-earthquake-relief-efforts,Japan Today,Haiti Earthquake
2021-08-15T00:10:13Z,M7.2 magnitude earthquake hits Haiti; at least 304 killed,https://japantoday.com/category/world/M7.2-magnitude-earthquake-hits-Haiti-at-least-304-killed,Japan Today,Haiti Earthquake
2021-08-15T14:24:21Z,"Hundreds are dead in Haiti earthquake, adding to plight of people there",https://www.bostonglobe.com/2021/08/15/world/hundreds-are-dead-haiti-earthquake-adding-plight-people-there/,The Boston Globe,Haiti Earthquake
2021-08-15T03:58:00Z,Road Closures After South Side Building Collapse Impacting Businesses - CBS Pittsburgh,https://pittsburgh.cbslocal.com/2021/08/15/road-closures-after-south-side-building-collapse-impacts-businesses/,Cbslocal.com,Haiti Earthquake
2021-08-15T14:26:05Z,"7.2-magnitude earthquake strikes Haiti, leaving more than 300 people dead",https://www.cnn.com/2021/08/15/world/haiti-earthquake-news-sunday/index.html,CNN,Haiti Earthquake
2021-08-15T15:25:07Z,"Naomi Osaka, Cardi B Among Celebrities Speaking Out After Haiti Earthquake",https://www.newsweek.com/naomi-osaka-cardi-b-among-celebrities-speaking-out-after-haiti-earthquake-1619493,Newsweek,Haiti Earthquake
2021-08-15T23:00:24Z,"Death toll of powerful eathquake in Haiti soars to 1,297",https://www.bostonherald.com/2021/08/15/death-toll-of-powerful-eathquake-in-haiti-soars-to-1297/,Boston Herald,Haiti Earthquake
2021-08-15T21:51:20Z,Death toll in massive Haiti quake jumps to 724,https://japantoday.com/category/world/death-toll-in-massive-haiti-quake-jumps-to-724-govt,Japan Today,Haiti Earthquake
2021-08-15T13:20:36Z,Naomi Osaka Will Donate Her Upcoming Tournament Earnings to Earthquake Relief Efforts in Haiti,https://www.teenvogue.com/story/naomi-osaka-tournament-earnings-haiti-earthquake-relief,Teen Vogue,Haiti Earthquake
2021-08-15T21:16:55Z,"Morning mail: Afghanistan falls, NSW cracks down, she’s no plain Jane",https://amp.theguardian.com/australia-news/2021/aug/16/morning-mail-afghanistan-falls-nsw-cracks-down-shes-no-plain-jane,The Guardian,Haiti Earthquake
2021-08-15T15:13:53Z,Tropical Storm Fred Regains Strength As It Nears Florida — Here’s Where Could Be Affected,https://www.forbes.com/sites/alisondurkee/2021/08/15/tropical-storm-fred-regains-strength-as-it-nears-florida---heres-where-could-be-affected/,Forbes,Haiti Earthquake
2021-08-15T12:39:00Z,Messi watches on as PSG make hard work of beating Strasbourg - Reuters,https://www.reuters.com/lifestyle/sports/messi-watches-psg-make-hard-work-beating-strasbourg-2021-08-14/,Reuters,PSG
2021-08-15T11:26:44Z,"A Premier League soccer team will sport the dogecoin logo on its jerseys as the meme token hits the soccer world, report says",https://www.businessinsider.com/dogecoin-watford-fc-premier-league-soccer-crypto-2021-8,Business Insider,PSG
2021-08-15T20:08:22Z,Barcelona lift post-Messi gloom with win over Real Sociedad,https://amp.theguardian.com/football/2021/aug/15/barcelona-real-sociedad-la-liga-match-report,The Guardian,PSG
2021-08-15T03:15:18Z,French League season opener: PSG fans cheer on Messi before 4-2 win,https://indianexpress.com/article/sports/football/french-league-season-opener-psg-fans-cheer-on-messi-before-4-2-win-7454390/,The Indian Express,PSG
2021-08-15T05:40:38Z,Ex-Juventus Footballer Takes Dig at Cristiano Ronaldo Who 'Plays for Himself Not for the Team',https://sputniknews.com/sport/202108151083606460-ex-juventus-footballer-takes-dig-at-cristiano-ronaldo-who-plays-for-himself-not-for-the-team/,Sputnik International,PSG
2021-08-15T19:59:32Z,"FC Barcelona Versus Real Sociedad Results, Reaction And What We Learned",https://www.forbes.com/sites/tomsanderson/2021/08/15/fc-barcelona-versus-real-sociedad-results-reaction-and-what-we-learned/,Forbes,PSG
2021-08-15T00:30:36Z,Football: Messi gets rapturous reception before watching PSG beat Strasbourg,https://www.channelnewsasia.com/sport/lionel-messi-psg-beat-strasbourg-mbappe-2113451,CNA,PSG
2021-08-15T07:50:05Z,Mauricio Pochettino insists he is delighted with 'focused' Kylian Mbappe despite PSG fans BOOING him,https://www.dailymail.co.uk/sport/football/article-9895105/Mauricio-Pochettino-insists-delighted-focused-Kylian-Mbappe-despite-PSG-fans-BOOING-him.html,Daily Mail,PSG
2021-08-15T01:30:00Z,Bottom line is always top priority,https://www.independent.ie/sport/soccer/bottom-line-is-always-top-priority-40752890.html,Independent.ie,PSG
2021-08-15T01:30:00Z,Real football the loser in fantasy game,https://www.independent.ie/sport/soccer/real-football-the-loser-in-fantasy-game-40752873.html,Independent.ie,PSG
2021-08-15T18:01:11Z,Crypto Corner: The Sports Slice,https://bitcoinist.com/crypto-corner-the-sports-slice-2/,Bitcoinist,PSG
2021-08-15T21:31:46Z,PSG will be happier on the pitch when Lionel Messi swaps the executive box for the penalty box,https://www.dailymail.co.uk/sport/football/article-9896101/PSG-happier-pitch-Lionel-Messi-swaps-executive-box-penalty-box.html,Daily Mail,PSG
2021-08-15T04:56:13Z,La Liga: Benzema scores twice as Real Madrid defeat Alaves,https://punchng.com/la-ligabenzema-scores-twice-as-real-madrid-defeat-alaves/,The Punch,PSG
2021-08-15T06:00:00Z,This can be a season of positive change in the Premier League - with hopes of a title race thriller,https://www.mirror.co.uk/sport/football/news/can-season-positive-change-premier-24760795,Mirror Online,PSG
2021-08-15T14:35:04Z,Dalmat: ‘Inter cannot afford to lose Barella’,https://football-italia.net/dalmat-inter-cannot-afford-to-lose-barella/,Football Italia,PSG
2021-08-15T14:54:42Z,Dumfries to Inter: ‘I like to attack a lot’,https://football-italia.net/dumfries-to-inter-i-like-to-attack-a-lot/,Football Italia,PSG
2021-08-15T09:41:42Z,Father of Barcelona wonderkid Ilaix Moriba admits he CANCELLED move to Man City,https://www.dailymail.co.uk/sport/football/article-9895191/Father-Barcelona-wonderkid-Ilaix-Moriba-admits-CANCELLED-Man-City.html,Daily Mail,PSG
2021-08-15T10:21:49Z,Barcelona fans adjust to life after Lionel Messi as season starts,https://indianexpress.com/article/sports/football/barcelona-fans-adjust-to-life-after-lionel-messi-as-season-starts-7454963/,The Indian Express,PSG
2021-08-15T07:19:00Z,"Messi receives rapturous ovation from 49,000 fans as PSG beat Strasbourg",https://www.business-standard.com/article/sports/messi-receives-rapturous-ovation-from-49-000-fans-as-psg-beat-strasbourg-121081500175_1.html,Business Standard,PSG
2021-08-15T03:35:51Z,Messi gets rapturous reception before watching PSG beat Strasbourg,https://timesofindia.indiatimes.com/sports/football/top-stories/lionel-messi-gets-rapturous-reception-before-watching-psg-beat-strasbourg/articleshow/85342724.cms,The Times of India,PSG
2021-08-15T04:51:11Z,News24.com | Messi gets rapturous reception before watching PSG beat Strasbourg,https://www.news24.com/sport/Soccer/International/messi-gets-rapturous-reception-before-watching-psg-beat-strasbourg-20210815,News24,PSG
2021-08-15T09:16:48Z,FC Barcelona Versus Real Sociedad Preview: Team News And Starting Lineup,https://www.forbes.com/sites/tomsanderson/2021/08/15/fc-barcelona-versus-real-sociedad-preview-team-news-and-starting-lineup/,Forbes,PSG
2021-08-15T20:05:07Z,Barcelona Defeat Real Sociedad in 1st Match Since Lionel Messi's Exit To PSG,https://bleacherreport.com/articles/10010398-barcelona-defeat-real-sociedad-in-1st-match-since-lionel-messis-exit-to-psg,Bleacher Report,PSG
2021-08-15T18:10:32Z,Bayern Munich looking to sign Arsenal defensive target,https://www.justarsenal.com/bayern-munich-looking-to-sign-arsenal-defensive-target/289031,Just Arsenal News,PSG
2021-08-15T21:30:57Z,Paul Pogba produced a sublime display but he is destined to walk away from Old Trafford,https://www.dailymail.co.uk/sport/football/article-9896113/Paul-Pogba-produced-sublime-display-destined-walk-away-Old-Trafford.html,Daily Mail,PSG
2021-08-15T06:30:00Z,Top 10 greatest-ever attacking trios after Lionel Messi joins Neymar and Kylian Mbappe,https://www.mirror.co.uk/sport/football/lionel-messi-barcelona-manchester-united-24748613,Mirror Online,PSG
2021-08-15T08:44:27Z,PSG present Messi to the fans at the Parc des Princes before Strasbourg game,https://www.marca.com/en/football/ligue-1/2021/08/15/6118cff346163fcb238b462c.html,Marca,PSG
2021-08-15T07:32:25Z,Newcastle vs West Ham live stream: How to watch Premier League fixture online and on TV today,https://www.independent.co.uk/sport/football/newcastle-west-ham-live-stream-b1902292.html,Independent,PSG
2021-08-15T07:32:37Z,"Is Newcastle vs West Ham on TV today? Kick-off time, channel and how to watch Premier League fixture",https://www.independent.co.uk/sport/football/newcastle-west-ham-tv-channel-b1902347.html,Independent,PSG
2021-08-15T14:13:19Z,The Mbappe situation reaches breaking point,https://www.marca.com/en/football/real-madrid/2021/08/15/61191f0946163f213f8b461b.html,Marca,PSG
2021-08-15T08:50:37Z,Where does Lionel Messi to PSG rank in football's most shocking transfers?,https://www.dailymail.co.uk/sport/football/article-9886699/Where-does-Lionel-Messi-PSG-rank-footballs-shocking-transfers.html,Daily Mail,PSG
2021-08-15T18:54:17Z,Brilliant scenes at Barcelona as Memphis repays Pique for wage cut with first post-Messi goal,https://www.101greatgoals.com/news/brilliant-scenes-at-barcelona-as-memphis-repays-pique-for-wage-cut-with-first-post-messi-goal/,101 Great Goals,PSG
2021-08-15T07:00:00Z,"Neymar and Lionel Messi's 'wrong turn', tears and WhatsApp messages that led to reunion",https://www.mirror.co.uk/sport/football/transfer-news/messi-neymar-psg-barcelona-transfer-24735783,Mirror Online,PSG
2021-08-15T12:10:35Z,Real Madrid hoping to sell Arsenal target to raise funds for Mbappe,https://www.justarsenal.com/real-madrid-hoping-to-sell-arsenal-target-to-raise-funds-for-mbappe/289017,Just Arsenal News,PSG
2021-08-15T21:30:46Z,IAN LADYMAN: Football can touch you in many ways - it is so much more than what happens on the pitch,https://www.dailymail.co.uk/sport/football/article-9896127/IAN-LADYMAN-Football-touch-ways-happens-pitch.html,Daily Mail,PSG
2021-08-15T02:34:25Z,Lionel Messi gets rapturous reception before PSG beats Strasbourg,https://www.japantimes.co.jp/sports/2021/08/15/soccer/psg-strasbourg-lionel-messi/,The Japan Times,PSG
2021-08-15T21:16:56Z,"Herrera's birthday party guest list: Messi, Ramos, Neymar... but no Mbappe",https://www.marca.com/en/football/ligue-1/2021/08/15/61198378ca47419b118b45dc.html,Marca,PSG
2021-08-15T20:05:45Z,Barcelona embark on life without Lionel Messi by winning thriller vs Real Sociedad,https://www.mirror.co.uk/sport/football/news/barcelona-embark-life-without-lionel-24765566,Mirror Online,PSG
2021-08-15T08:43:38Z,Barcelona fans adjust to life after Messi as season starts,https://apnews.com/2e0c223751ab5186e06668150cd3c9e0,Associated Press,PSG
2021-08-15T17:28:40Z,Bosz awaits 1st win as Lyon coach after 3-0 loss at Angers,https://apnews.com/cb48530b299547caa2f2d30f2b13fcbf,Associated Press,PSG
2021-08-15T20:13:59Z,Barcelona start post-Messi era with win over Real Sociedad,https://www.irishtimes.com/sport/soccer/barcelona-start-post-messi-era-with-win-over-real-sociedad-1.4647833,The Irish Times,PSG
2021-08-15T00:41:28Z,PSG 4-2 Strasbourg: Messi and Neymar watch as new side almost stutter,http://www.dpa-international.com/topic/psg-4-2-strasbourg-messi-neymar-watch-new-side-almost-urn%3Anewsml%3Adpa.com%3A20090101%3A210815-99-844951,Dpa-international.com,PSG
2021-08-15T21:40:25Z,"Weekend review: Pogba stars, Haaland superb, Spurs beat Man City without Kane",https://www.espn.com/soccer/blog-espn-fc-united/story/4454524/pogbas-masterclasshaaland-in-formspurs-beat-man-city-without-kane-what-you-missed-this-weekend,ESPN,PSG
